{
  "version": 2,
  "meta": {
    "name": "swearjar-rulepack-core",
    "generated_at": "2025-09-16T19:12:50Z",
    "notes": "Core/shared config. Language-specific content lives in per-lang fragments."
  },
  "categories": [
    "generic",
    "harassment",
    "self_own",
    "tooling_rage",
    "bot_rage",
    "lang_rage"
  ],
  "variants_spec": {
    "gapped": {
      "description": "Allow non-word chars between letters"
    },
    "leet": {
      "description": "Conservative leet mapping (@:a,0:o,1:i/l,3:e,5:s,7:t,$:s,!:i)"
    },
    "repeat_collapse": {
      "description": "Collapse long character runs (>2)"
    },
    "confusables": {
      "description": "Map Unicode confusables to ASCII skeleton"
    }
  },
  "zones": {
    "names": ["plain", "quote", "code", "identifier", "url", "email", "emoji"],
    "notes": "Engines may apply severity dampening by zone."
  },
  "slots": {
    "TARGET_BOT": {
      "aliases": [
        {
          "id": "dependabot",
          "names": ["dependabot", "@dependabot"]
        },
        {
          "id": "renovate",
          "names": ["renovate", "@renovate"]
        },
        {
          "id": "mergify",
          "names": ["mergify", "@mergify"]
        },
        {
          "id": "codecov",
          "names": ["codecov", "@codecov"]
        },
        {
          "id": "codeql",
          "names": ["codeql", "github codeql", "gh codeql"]
        },
        {
          "id": "snyk",
          "names": ["snyk", "@snyk"]
        },
        {
          "id": "gha",
          "names": ["github actions", "gh actions", "actions", "gha"]
        },
        {
          "id": "circleci",
          "names": ["circleci", "circle ci"]
        },
        {
          "id": "travis",
          "names": ["travis", "travis ci"]
        },
        {
          "id": "gitlab_ci",
          "names": ["gitlab ci", "gitlab-ci"]
        },
        {
          "id": "jenkins",
          "names": ["jenkins"]
        }
      ]
    },
    "TARGET_TOOL": {
      "aliases": [
        {
          "id": "eslint",
          "names": ["eslint", "@eslint"]
        },
        {
          "id": "prettier",
          "names": ["prettier"]
        },
        {
          "id": "flake8",
          "names": ["flake8"]
        },
        {
          "id": "black",
          "names": ["black (formatter)", "black formatter"]
        },
        {
          "id": "pylint",
          "names": ["pylint"]
        },
        {
          "id": "mypy",
          "names": ["mypy"]
        },
        {
          "id": "golangci_lint",
          "names": ["golangci-lint", "golangci lint"]
        },
        {
          "id": "tsc",
          "names": ["tsc", "typescript compiler", "typescript"]
        },
        {
          "id": "jest",
          "names": ["jest"]
        },
        {
          "id": "npm",
          "names": ["npm"]
        },
        {
          "id": "pnpm",
          "names": ["pnpm"]
        },
        {
          "id": "gradle",
          "names": ["gradle"]
        },
        {
          "id": "maven",
          "names": ["maven", "mvn"]
        },
        {
          "id": "ci_generic",
          "names": ["ci", "build", "pipeline", "runner"]
        },
        {
          "id": "formatter",
          "names": ["formatter", "code formatter"]
        },
        {
          "id": "coverage",
          "names": ["coverage", "lcov", "cobertura"]
        }
      ]
    },
    "TARGET_LANG": {
      "aliases": [
        {
          "id": "javascript",
          "names": ["javascript", "js", "node", "nodejs"]
        },
        {
          "id": "typescript",
          "names": ["typescript", "ts"]
        },
        {
          "id": "python",
          "names": ["python", "py"]
        },
        {
          "id": "go",
          "names": ["go", "golang"]
        },
        {
          "id": "rust",
          "names": ["rust"]
        },
        {
          "id": "java",
          "names": ["java"]
        },
        {
          "id": "ruby",
          "names": ["ruby", "rb"]
        },
        {
          "id": "php",
          "names": ["php"]
        },
        {
          "id": "csharp",
          "names": ["c#", "csharp", "dotnet", ".net"]
        },
        {
          "id": "cpp",
          "names": ["c\\+\\+", "cpp"]
        }
      ]
    },
    "TARGET_FRAMEWORK": {
      "aliases": [
        {
          "id": "react",
          "names": ["react", "reactjs"]
        },
        {
          "id": "vue",
          "names": ["vue", "vuejs"]
        },
        {
          "id": "angular",
          "names": ["angular", "ng"]
        },
        {
          "id": "django",
          "names": ["django"]
        },
        {
          "id": "spring",
          "names": ["spring", "spring boot"]
        },
        {
          "id": "rails",
          "names": ["rails", "rubyonrails", "ruby on rails"]
        }
      ]
    }
  },
  "allowlist": {
    "global": [
      "assistant",
      "assess",
      "assessment",
      "assessor",
      "assimilate",
      "associate",
      "association",
      "passage",
      "passive",
      "compass",
      "compassion",
      "password",
      "surpass",
      "class",
      "classic",
      "classify",
      "classification",
      "declassify",
      "assign",
      "assignment",
      "reassignment",
      "scunthorpe",
      "shiitake",
      "shiitake mushroom",
      "shihtzu",
      "shih tzu",
      "bitchute",
      "passing",
      "passcode",
      "passenger",
      "grasshopper",
      "morass",
      "sass",
      "sassc",
      "javascript",
      "typescript"
    ],
    "by_zone": {
      "code": [
        "class",
        "pass",
        "assert",
        "password",
        "assign",
        "assignment",
        "sass",
        "sassc",
        "typescript",
        "javascript",
        "passcode",
        "classname"
      ],
      "identifier": [
        "class",
        "pass",
        "passwd",
        "assert",
        "process_pass",
        "passkey",
        "typescript",
        "javascript"
      ],
      "url": ["pass", "sass", "class", "typescript", "javascript"]
    }
  },
  "engine_hints": {
    "normalization": {
      "casefold": true,
      "nfkc": true,
      "strip_variation_selectors": true,
      "collapse_whitespace": true,
      "collapse_repeats_threshold": 3,
      "confusables_map": "default"
    },
    "search": {
      "use_aho_corasick_for_lemmas": true,
      "scan_shadow_strings": ["leet", "confusables"],
      "gapped_max_gap": 3,
      "max_context_window": 80,
      "use_script_boundaries": true,
      "word_boundary_strategy": "unicode_grapheme_or_script"
    },
    "lang_routing": {
      "fallback": ["en"],
      "min_confidence": 0.6
    }
  },
  "severity_mods": [
    {
      "id": "boost.direct_address",
      "if": {
        "direct_address": true
      },
      "delta": 1,
      "cap": 3
    },
    {
      "id": "boost.mention_target",
      "if": {
        "has_mention": true
      },
      "delta": 1,
      "cap": 3
    },
    {
      "id": "boost.repetition",
      "if": {
        "repeated_token": true
      },
      "delta": 1,
      "cap": 3
    },
    {
      "id": "reduce.in_code",
      "if": {
        "zone": "code"
      },
      "delta": -1,
      "floor": 0
    },
    {
      "id": "reduce.in_identifier",
      "if": {
        "zone": "identifier"
      },
      "delta": -1,
      "floor": 0
    },
    {
      "id": "reduce.quote",
      "if": {
        "zone": "quote"
      },
      "delta": -1,
      "floor": 0
    }
  ]
}
